{
  "schemaVersion": 1,
  "slug": "pixellab",
  "kind": "youtube-channel",
  "title": "PixelLab",
  "url": "https://www.youtube.com/channel/UCz-FR-s8sge9njmiUCRSUOg",
  "priority": "inbox",
  "status": "active",
  "channelId": "UCz-FR-s8sge9njmiUCRSUOg",
  "owner": "PixelLab",
  "topics": [
    "pixel-art",
    "ai-art-tools",
    "asset-generation",
    "game-art-pipeline"
  ],
  "rights": {
    "transcriptPolicy": "public-captions",
    "storeRawTranscript": true,
    "notes": "Public YouTube captions fetched at user direction for internal study. Prefer distilled rules over raw dumps in derivatives. Remove raw text if the channel objects."
  },
  "desiredOutputs": [
    "tool",
    "rule"
  ],
  "notes": [
    "Added 2026-06-09 at user request from a single video; not yet vetted as a primary reference.",
    "Relevant to the assetgen pixel-art / sprite pipeline; evaluate the tooling claims against our defringe + atlas flow.",
    "Auto-generated English captions only; expect noisier transcript text."
  ]
}
