{
  "schemaVersion": 1,
  "slug": "nionx",
  "kind": "youtube-channel",
  "title": "NIONX",
  "url": "https://www.youtube.com/channel/UCIm5H46j3uB5gxz0lM0jrjw",
  "priority": "inbox",
  "status": "active",
  "channelId": "UCIm5H46j3uB5gxz0lM0jrjw",
  "owner": "NIONX",
  "topics": [
    "ai-assisted-development",
    "game-production",
    "unreal-engine",
    "3d-games",
    "beginner-from-zero"
  ],
  "rights": {
    "transcriptPolicy": "public-captions",
    "storeRawTranscript": true,
    "notes": "Public YouTube captions fetched at user direction for internal study. Prefer distilled rules over raw dumps in derivatives. Remove raw text if the channel objects."
  },
  "desiredOutputs": [
    "rule",
    "skill"
  ],
  "notes": [
    "Added 2026-06-09 at user request from a single video; not yet vetted as a primary reference.",
    "French-language channel; English captions available. Focus: recreating known games in UE5 with little prior experience.",
    "Mine for repeatable AI-assisted production workflows, not generic hype."
  ]
}
